<?xml version="1.0" encoding="UTF-8"?>
<table name="manufacturer_purchaser_mapping" 
xmlns="http://www.babyfishdemo.org/war3shop/db-installer" 
xmlns:xsi="http://www.w3.org/2001/XMLSchema-instance" 
xsi:schemaLocation="http://www.babyfishdemo.org/war3shop/db-installer table.xsd">
    <schema>
        <primary-key>
            <foreign-key reference="manufacturer">
                <column name="manufacturer_id" type="long"/>
            </foreign-key>
            <foreign-key reference="user">
                <column name="purchaser_id" type="long"/>
            </foreign-key>
        </primary-key>
    </schema>
    <data>
        <row manufacturer_id="11" purchaser_id="6"/>
        <row manufacturer_id="12" purchaser_id="6"/>
        <row manufacturer_id="13" purchaser_id="6"/>
        <row manufacturer_id="14" purchaser_id="6"/>
        <row manufacturer_id="15" purchaser_id="6"/>
        <row manufacturer_id="16" purchaser_id="6"/>
        <row manufacturer_id="17" purchaser_id="6"/>
        <row manufacturer_id="18" purchaser_id="6"/>
        <row manufacturer_id="19" purchaser_id="6"/>
        <row manufacturer_id="1" purchaser_id="6"/>
        <row manufacturer_id="2" purchaser_id="6"/>
        <row manufacturer_id="3" purchaser_id="6"/>
        <row manufacturer_id="32" purchaser_id="6"/>
        <row manufacturer_id="33" purchaser_id="6"/>
        <row manufacturer_id="34" purchaser_id="6"/>
        <row manufacturer_id="26" purchaser_id="6"/>
        <row manufacturer_id="27" purchaser_id="6"/>
        <row manufacturer_id="28" purchaser_id="6"/>
        
        <row manufacturer_id="1" purchaser_id="7"/>
        <row manufacturer_id="2" purchaser_id="7"/>
        <row manufacturer_id="3" purchaser_id="7"/>
        <row manufacturer_id="4" purchaser_id="7"/>
        <row manufacturer_id="5" purchaser_id="7"/>
        <row manufacturer_id="6" purchaser_id="7"/>
        <row manufacturer_id="7" purchaser_id="7"/>
        <row manufacturer_id="8" purchaser_id="7"/>
        <row manufacturer_id="9" purchaser_id="7"/>     
        <row manufacturer_id="10" purchaser_id="7"/>
        <row manufacturer_id="29" purchaser_id="7"/>
        <row manufacturer_id="30" purchaser_id="7"/>
        <row manufacturer_id="31" purchaser_id="7"/>
        <row manufacturer_id="23" purchaser_id="7"/>
        <row manufacturer_id="24" purchaser_id="7"/>
        <row manufacturer_id="25" purchaser_id="7"/>
        <row manufacturer_id="17" purchaser_id="7"/>
        <row manufacturer_id="18" purchaser_id="7"/>
        <row manufacturer_id="19" purchaser_id="7"/>
        
        <row manufacturer_id="29" purchaser_id="8"/>
        <row manufacturer_id="30" purchaser_id="8"/>
        <row manufacturer_id="31" purchaser_id="8"/>
        <row manufacturer_id="32" purchaser_id="8"/>
        <row manufacturer_id="33" purchaser_id="8"/>
        <row manufacturer_id="34" purchaser_id="8"/>
        <row manufacturer_id="35" purchaser_id="8"/>
        <row manufacturer_id="36" purchaser_id="8"/>
        <row manufacturer_id="37" purchaser_id="8"/>
        <row manufacturer_id="20" purchaser_id="8"/>
        <row manufacturer_id="21" purchaser_id="8"/>
        <row manufacturer_id="22" purchaser_id="8"/>
        <row manufacturer_id="14" purchaser_id="8"/>
        <row manufacturer_id="15" purchaser_id="8"/>
        <row manufacturer_id="16" purchaser_id="8"/>
        <row manufacturer_id="8" purchaser_id="8"/>
        <row manufacturer_id="9" purchaser_id="8"/>
        <row manufacturer_id="10" purchaser_id="8"/>
        
        <row manufacturer_id="20" purchaser_id="9"/>
        <row manufacturer_id="21" purchaser_id="9"/>
        <row manufacturer_id="22" purchaser_id="9"/>
        <row manufacturer_id="23" purchaser_id="9"/>
        <row manufacturer_id="24" purchaser_id="9"/>
        <row manufacturer_id="25" purchaser_id="9"/>
        <row manufacturer_id="26" purchaser_id="9"/>
        <row manufacturer_id="27" purchaser_id="9"/>
        <row manufacturer_id="28" purchaser_id="9"/>
        <row manufacturer_id="11" purchaser_id="9"/>
        <row manufacturer_id="12" purchaser_id="9"/>
        <row manufacturer_id="13" purchaser_id="9"/>
        <row manufacturer_id="4" purchaser_id="9"/>
        <row manufacturer_id="5" purchaser_id="9"/>
        <row manufacturer_id="6" purchaser_id="9"/>
        <row manufacturer_id="35" purchaser_id="9"/>
        <row manufacturer_id="36" purchaser_id="9"/>
        <row manufacturer_id="37" purchaser_id="9"/>
        
        <row manufacturer_id="38" purchaser_id="10"/>
        <row manufacturer_id="39" purchaser_id="10"/>
        <row manufacturer_id="40" purchaser_id="10"/>
        <row manufacturer_id="41" purchaser_id="10"/>
        <row manufacturer_id="10" purchaser_id="10"/>
        <row manufacturer_id="19" purchaser_id="10"/>
        <row manufacturer_id="28" purchaser_id="10"/>
        <row manufacturer_id="37" purchaser_id="10"/>
        
        <row manufacturer_id="10" purchaser_id="2"/>
        <row manufacturer_id="19" purchaser_id="2"/>
        <row manufacturer_id="28" purchaser_id="2"/>
        <row manufacturer_id="37" purchaser_id="2"/>
        <row manufacturer_id="38" purchaser_id="6"/>
        <row manufacturer_id="39" purchaser_id="6"/>
        <row manufacturer_id="40" purchaser_id="6"/>
        <row manufacturer_id="41" purchaser_id="6"/>
    </data>
</table>
