<?xml version="1.0"?>
<table 
name="privilege"
xmlns="http://www.babyfishdemo.org/war3shop/db-installer" 
xmlns:xsi="http://www.w3.org/2001/XMLSchema-instance" 
xsi:schemaLocation="http://www.babyfishdemo.org/war3shop/db-installer table.xsd">
    <schema>
        <primary-key sequence="privilege_id_seq">
            <column name="privilege_id" type="long"/>
        </primary-key>
        <column name="version" type="int"/>
        <unique>
            <column name="name" type="string[50]"/>
        </unique>
    </schema>
    <data>
        <row
            privilege_id="1"
            version="1"
            name="manage-manufacturers"/>
        <row
            privilege_id="2"
            version="1"
            name="manage-products"/>
        <row
            privilege_id="3"
            version="1"
            name="manage-preferentials"/>
        <row
            privilege_id="4"
            version="1"
            name="purchase-products"/>
        <row
            privilege_id="5"
            version="1"
            name="manage-orders"/>
        <row
            privilege_id="6"
            version="1"
            name="delivery-orders"/>
    </data>
</table>
