<?xml version="1.0"?>
<table 
name="alarm"
xmlns="http://www.babyfishdemo.org/war3shop/db-installer" 
xmlns:xsi="http://www.w3.org/2001/XMLSchema-instance" 
xsi:schemaLocation="http://www.babyfishdemo.org/war3shop/db-installer table.xsd">
    <schema>
        <primary-key sequence="alarm_id_seq">
            <column name="alarm_id" type="long"/>
        </primary-key>
        <column name="version" type="int"/>
        <column name="creation_time" type="timestamp"/>
        <column name="message" type="string[400]"/>
        <column name="acknowledged" type="boolean"/>
        <foreign-key reference="user">
            <column name="user_id" type="long"/>
        </foreign-key>
    </schema>
</table>
