<?xml version="1.0"?>
<table 
name="gift_item"
xmlns="http://www.babyfishdemo.org/war3shop/db-installer" 
xmlns:xsi="http://www.w3.org/2001/XMLSchema-instance" 
xsi:schemaLocation="http://www.babyfishdemo.org/war3shop/db-installer table.xsd">
    <schema>
        <primary-key sequence="gift_item_id_seq">
            <column name="gift_item_id" type="long"/>
        </primary-key>
        <foreign-key reference="order">
            <column name="order_id" type="long"/>
        </foreign-key>
        <foreign-key reference="product">
            <column name="product_id" type="long"/>
        </foreign-key>
        <column name="instant_unit_price" type="decimal"/>
        <column name="quantity" type="int"/>
    </schema>
</table>
