<?xml version="1.0"?>
<table 
name="variable"
xmlns="http://www.babyfishdemo.org/war3shop/db-installer" 
xmlns:xsi="http://www.w3.org/2001/XMLSchema-instance" 
xsi:schemaLocation="http://www.babyfishdemo.org/war3shop/db-installer table.xsd">
    <schema>
        <primary-key>
            <column name="name" type="string[30]"/>
        </primary-key>
        <column name="value" type="string[100]?"/>
        <column name="encrypted_value" type="binary[256]?"/>
    </schema>
    <data>
        <row 
            name="sys.email.protocol"
            value="${sys.email.protocol}"/>
        <row 
            name="sys.email.host"
            value="${sys.email.host}"/>
        <row
            name="sys.email.ssl"
            value="${sys.email.ssl}"/>
        <row 
            name="sys.email.port"
            value="${sys.email.port}"/>
        <row 
            name="sys.email.user"
            value="${sys.email.user}"/>
        <row 
            name="*sys.email.password"
            encrypted_value="rsa(${*sys.email.password})"/>
    </data>
</table>
